{
  "kind": "event",
  "event_id": "EV-2025-0001",
  "stream_id": "ICEP-LOG-1",
  "event_type": "INTENT_DECLARED",
  "actor": {
    "actor_id": "agent-auth",
    "actor_type": "agent"
  },
  "timestamp": "2025-01-15T12:30:05Z",
  "payload_ref": {
    "uri": "https://example.com/icep/intent/I-2025-0001.json",
    "media_type": "application/json",
    "digest": {
      "algo": "sha256",
      "hash": "e1e1e1e1e1e1e1e1e1e1e1e1e1e1e1e1e1e1e1e1e1e1e1e1e1e1e1e1e1e1e1e1"
    }
  }
}
